{
  "schema_version": 1,
  "task_id": "Task-0001",
  "pass_id": "PASS-0001",
  "checklist_status": "closed",
  "implemented": true,
  "build": "not_applicable",
  "unit_tests": "passing",
  "pass_audit_written": true,
  "audit_verdict": "ready",
  "audit_result_ref": "Testing/PASS-0001-AUDIT.json",
  "handoff_updated": true,
  "commit_created": true,
  "pushed_upstream": false,
  "notify_sent": true,
  "blockers": [],
  "next_required_actions": [],
  "updated_at": "2026-04-02T20:49:00-04:00"
}
