{
  "schema_version": 1,
  "task_id": "Task-0002",
  "pass_id": "PASS-0000",
  "checklist_status": "closed",
  "implemented": true,
  "build": "not_applicable",
  "unit_tests": "passing",
  "pass_audit_written": true,
  "audit_verdict": "ready_with_caveats",
  "audit_result_ref": "Testing/PASS-0000-AUDIT.json",
  "handoff_updated": true,
  "commit_created": true,
  "pushed_upstream": true,
  "notify_sent": true,
  "blockers": [],
  "next_required_actions": [],
  "updated_at": "2026-04-02T22:12:47-04:00"
}
